DBSCAN_labels,Key,Title,Link,Content
21,WaPo_9,Justice Dept. settles with ex-FBI officials over leak of anti-Trump texts,https://www.washingtonpost.com/dc-md-va/2024/07/26/strzok-page-fbi-settlement-trump-text-leak/,"The Justice Department has agreed to settle claims by former senior FBI special agent Peter P. Strzok and FBI lawyer Lisa Page, who had filed lawsuits accusing the government of violating their privacy rights by leaking their politically charged text messages criticizing Donald Trump.Strzok will receive a $1.2 million settlement and Page $800,000, according to their attorneys and settlement agreements released by the department.Strzok and Page said they were illegally targeted for retribution by the Trump administration after the FBI investigated Russia’s interference in the 2016 presidential election.Strzok, a former top counterintelligence expert, was fired by the FBI in 2018 after news reports surfaced of his politically charged text messages with Page, in which the pair criticized Trump while having an affair.“This outcome is a critical step forward in addressing the government’s unfair and highly politicized treatment of Pete,” lead Strzok attorney Aitan D. Goelman said in a statement. Goelman said Strzok will continue to seek reinstatement and back pay in ongoing litigation over claims that removing him from the FBI violated his free speech and due process rights.“We will continue to litigate Pete’s constitutional claims to ensure that, in the future, public servants are protected from adverse employment actions motivated by partisan politics,” Goelman said.In a statement released by her attorneys, Page said, “While I have been vindicated by this result, my fervent hope remains that our institutions of justice will never again play politics with the lives of their employees.”Page’s Arnold & Porter law firm team, led by Amy Jeffress, added, “As Attorney General [Merrick] Garland recently testified in response to questions about this settlement, the Department settles cases based on the litigators’ assessment of the chances of success and the potential costs of losing the case. Here, the evidence was overwhelming that the release of text messages to the press in December 2017 was for partisan political purposes and was against the law. As the Attorney General explained: ‘It’s a question of the government paying for violating the law.’”A spokesman for the Justice Department declined to comment outside of court filings.Separate agreements signed by the respective plaintiffs and senior trial counsel Bradley P. Humphreys with the Justice Department’s federal programs branch stated that they were entered “solely for the purposes of compromising disputed claims without further legal proceedings and avoiding the expense and risk of litigation,” and were not an admission by either party. The text exchanges between Strzok and Page, which came to light in December 2017, fueled Republican allegations that FBI bias against Trump drove the Russia investigation, and became fodder for scores of angry tweets and public statements by the then-president and his supporters.Page left the FBI in 2018, and Strzok was fired that August. Both were assigned before the 2016 election to investigate Russian interference into Trump’s campaign and whether former secretary of state Hillary Clinton broke the law by using a private email server.An inspector general’s investigation found no evidence that their opinions affected their work; a special counsel appointed by Trump was more critical of the FBI but agreed that investigating Russian interference was warranted.Strzok filed suit in August 2019, claiming he was unfairly terminated for criticizing the president. Page filed suit that December, accusing the FBI and the Justice Department of violating the Privacy Act by showing reporters a document containing nearly 400 texts between her and Strzok, in which the pair discussed their intense dislike of Trump and their fear that he might win the presidency.The settlement came after attorneys for the two former employees won court approval to question Trump and FBI Director Christopher A. Wray separately under oath.Trump was deposed in October 2023, after publicly bragging about firing FBI officials.On “The Hugh Hewitt Show” in February 2023, Trump stood by pushing out former FBI director James B. Comey, former FBI deputy director Andrew McCabe, and Strzok and Page, calling them “scum” who were “trying to do an overthrow.”Trump added, “They spied on my campaign, and I got rid of them all. … But … it was more than them, and you know that.”Strzok and Page used work phones to exchange messages critical of numerous politicians, especially Trump, whom Strzok derided as “abysmal” and a “disaster.”In August 2016, after Page wrote that Trump was “not ever going to become president, right? Right?!” Strzok responded: “No. No he’s not. We’ll stop it.”Trump has vowed to seek revenge if he wins election again and regains control of the Justice Department, according to people who have talked to him, The Washington Post has reported. He has privately discussed using the government to punish critics and opponents, including prosecuting officials at the FBI and the Justice Department, and mused publicly about weaponizing the department.House Republicans challenged Garland at a June 4 hearing over reports that a tentative deal with Strzok and Page had been reached. House Judiciary Committee Chairman Jim Jordan (R-Ohio) quoted from text messages the pair sent criticizing Trump.“They are getting money from the taxpayers because you decided that is the right thing to do?” Jordan said. “You go after the president and you are rewarded?”"
34,CNN_7,"California’s Park Fire now among state’s top 13 largest ever as it consumes 239,000 acres",https://edition.cnn.com/2024/07/26/us/california-park-fire-oregon-durkee-jasper/index.html,"
Hot and dry weather is fueling wildfire activity in the Western United States and Canada, with fires damaging homes, causing injuries and forcing evacuations. The largest active wildfire in the US has scorched more than 280,000 acres in eastern Oregon and another blaze has exploded to more than 239,000 acres in California. Here’s the latest:


            • Park Fire roars across parts of Butte and Tehama counties, north of Sacramento, California: As of Friday evening, the Park Fire has burned more than 239,000 acres, or about 373 square miles, about the size of San Diego, which makes it the 13th largest in state history. More than 1,600 firefighters are working to slow its progress. Cal Fire reported the blaze was 0% contained Friday, with 134 structures destroyed and another 4,200 threatened. Gov. Gavin Newsom declared a state of emergency for both counties Friday. The state also secured a grant from the Federal Emergency Management Agency to ensure there are enough resources to fight the fire.
    

            Billy See, incident commander for Cal Fire, said the fire is advancing at 4,000 to 5,000 acres per hour but with winds forecast to die down overnight and higher humidity moving into the area, See believes it will give firefighters a better chance to slow the fire down. He noted fire crews are working to hold the fire south of California Highway 36.
    

            The fire has forced road closures and mandatory evacuations in Butte County, where the state’s deadliest wildfire, the Camp Fire, killed more than 85 people and destroyed thousands of homes in 2018. Local officials cautioned it would take some time before people would be allowed back in their homes and urged residents to visit county websites for the most up-to-date information on evacuations and road closures.
    

            • Three firefighters injured and structures damaged: Three firefighters had minor heat-related injuries on Wednesday while fighting the Park Fire, Cal Fire Captain Dan Collins told CNN Thursday. They were treated and released, he said. Officials know structures have been damaged or destroyed by the fire, but there is no official count yet, Collins said.
    

• Man accused of starting California wildfire is arrested: A suspect has been arrested on suspicion of pushing a burning car 60 feet into a gully, “spreading flames” that caused what’s now become California’s largest wildfire of the year, authorities said. The Park Fire in the Butte County area has quickly burned an area larger than the city of Atlanta.
    

            • Firefighters battle massive Oregon fire: The Durkee Fire, which has burned more than 288,000 acres and is 20% contained as of Friday afternoon, started on July 17 near the Oregon-Idaho state line. The lightning-sparked fire is the largest of 34 large wildfires currently burning across Oregon, which has been the hardest hit by fires in recent days. More than 500 firefighters and resources from 22 states are working to fight the fire, according to InciWeb. Over the weekend and earlier this week, the Durkee Fire exhibited extreme fire behavior, even creating its own weather in the form of pyrocumulus clouds.
    

            • Oregon wildfire destroys buildings: Three people were injured and two homes and 12 other structures were destroyed as the fire spread, according to the Oregon Department of Emergency Management. Evacuations are still in effect in Baker County for areas around the Durkee Fire. Some communities do not have power, according to Oregon Gov. Tina Kotek, who has deployed resources from the National Guard to assist. Dense smoke from the flames has also impeded traffic on Interstate 84, leading to periodic closure of the freeway. Wildfire smoke was spreading into Boise and beyond. Air quality alerts have been issued for parts of Colorado, Idaho, Oregon and Washington.
    

            • Wildfire engulfs tourist town in Canada: A fast-moving wildfire sent thousands of visitors and residents fleeing the town of Jasper in Alberta, where flames devastated up to half of the town’s structures. Officials say the losses are significant, and Prime Minister Justin Trudeau has deployed federal support to help battle the blaze. Cool temperatures and rain are expected to keep fire behavior low for the next 72 hours, which will help crews fight the blaze, Jasper National Park said on Facebook Thursday night.
    

            • Fire-conducive weather continues in Western US: Triple-digit heat and dry conditions across the West this week have made conditions poor for firefighters actively fighting to contain the 89 large wildfires burning nationwide. “Many wildfires in the Northwest area continue to exhibit active to extreme fire behavior, with evacuation orders in effect on 17 wildfires. Several teams are managing multiple fire starts as complexes. Evacuation orders are also in effect for several fires in California, the Northern Rockies and the Great Basin,” the National Interagency Fire Center said. Conditions will begin to improve for much of the West over the weekend as cooler temperatures and higher humidity levels arrive in the area.
    

            Some families have found themselves displaced as the Park Fire raged near Chico, a city in northern California, burning homes and forcing evacuations.
    

            A former news anchor told CNN affiliate KOVR she watched her Butte County house burn down live through security camera footage.
    

            “There is no rhyme or reason. Our house is gone, their house is okay. The house next to it, you can see it’s gone,” Julia Yarbough said.
    

            Looking at the remnants of her home, Yarbough said she felt numb.
    

            “It’s surreal,” she said. “It probably won’t hit me till later, I’m pretty sure.”
    

            Triple-digit temperatures and high wind gusts have fueled the explosive growth of the Park Fire amid an active fire season in California. An estimated 343,253 acres have burned across the state so far in 2024, compared to 22,439 acres burned by this time last year, according to Cal Fire.
    

            A 42-year-old man, identified as Ronnie Dean Stout II, has been arrested after being accused of igniting the inferno.
    

            Witnesses reported seeing someone “pushing a car that was on fire into a gully near the Alligator Hole in upper Bidwell Park shortly before 3:00 p.m. yesterday,” Butte County District Attorney Mike Ramsey said Thursday. “The car went down an embankment approximately 60 feet and burned completely, spreading flames that caused the Park Fire.”
    

            The DA says the man was seen “calmly leaving the area by blending in with the other citizens who were in the area and fleeing the rapidly evolving fire.” Stout was later arrested at a mobile home park in Chico, Ramsey said.
    

            Stout will likely face an arson charge, though it is unclear what count, or whether any enhancements will be added, Ramsey said. The DA’s office told CNN Stout has not retained an attorney and will be assigned a public defender at his arraignment.
    

            He was previously convicted of second degree robbery, assault with a deadly weapon and drug paraphernalia possession in Kern County, according to criminal records. He was sentenced to 21 years in prison. He was released on parole in 2018, the California Department of Corrections and Rehabilitation confirmed to CNN.
    

            He was also convicted of lewd or lascivious acts on a child under 14 in Butte County, records show.
    

            In Jasper, a popular tourist town in Alberta, 25,000 residents and visitors were forced to evacuate from a fast-moving blaze that has damaged 30 to 50% of the town’s structures, officials said during a news conference Thursday.
    

            “Homes and businesses have been lost to a wildfire that people are calling a ‘wall of flames,’” Alberta Premier Danielle Smith said.
    

            An “enormous wind gust” moved the wildfire roughly about 3 miles in “probably less than 30 minutes,” Alberta Minister of Public Safety & Emergency Services Mike Ellis said during the press conference. This created “a wall of fire that was about 100 meters high.”
    

            “Any firefighter will tell you there is little to nothing you can do when you have a wall of flames coming at you like that. Nobody anticipated that fire to come so fast, so large,” Ellis said.
    

            Two wildfires converged in the Jasper National Park area, becoming what authorities are referring to as the Jasper Wildfire Complex. It remains difficult to measure exactly how big the complex – which also includes a third nearby fire – is due to extreme fire behavior and thick smoke cover. Together, the fires have swallowed an estimated 89,000 acres, the Jasper National Park said.
    

            Damage wrought by the flames will result in “a significant rebuild and significant displacement,” Smith said. The most significant structural damage lies on the west side of town, according to a Facebook post from Jasper National Park.
    

Related article
Fast-moving wildfire in the Canadian Rockies’ largest national park hits the town of Jasper


            “We will recover from this,” Smith said while holding back tears. “To those in Alberta and around the world who have experienced the magic of Jasper, the magic is not lost, and it never will be.”
    

            The vast majority of evacuees were “visitors with other places to return to,” Ellis said. Along with about 5,000 residents who live in the town, 2.48 million people visited Jasper National Park last year.
    

            Jasper Mayor Richard Ireland said residents will work together to rebuild after the wildfire “ravaged our beloved community.”
    

            “Your resilience and strength have always been the backbone of our community. In the coming days and weeks, we will rally together, support one another, and begin the daunting process of recovery,” Ireland said in a statement on Thursday.
    

            Prime Minister Justin Trudeau said all federal agencies are working together to provide resources to Jasper, support evacuations and strengthen response efforts on the ground.
    

            “Our governments are working together to keep Albertans safe and supported through this,” he said on Facebook.
    

  CNN’s Robert Shackelford, Jillian Sykes, Lauren Mascarenhas, Paradise Afshar, Taylor Romine and Cheri Mossburg contributed to this report.
"
34,WaPo_24,Park Fire’s rapid growth puts it among largest in California history,https://www.washingtonpost.com/weather/2024/07/27/park-fire-chico-california/,"The Park Fire in Northern California grew rapidly to more than 307,000 acres late Friday, fueled by winds and steep terrain, officials said, making what was already California’s largest wildfire this year among the largest in state history.The fire, which officials suspect was the result of arson, started near Chico and then rapidly exploded, stoked by extreme heat and dense, dry brush. So far it has continued to grow unabated, burning at a rate of 4,000 to 5,000 acres per hour and scorching rugged, difficult terrain filled with grass, brush, timber and dead vegetation, officials said Friday.The fire is currently 0 percent contained, according to Cal Fire, and has prompted evacuation orders in Butte, Tehama and Shasta counties as it moves rapidly on its northern and eastern flanks. The blaze has been progressing north toward the city of Redding, crossing Highway 36 and threatening small towns such as Shingletown and Manton, according to fire mapping and experts.California Gov. Gavin Newsom (D) on Friday declared a state of emergency in Butte and Tehama counties in response to the fire, saying in a statement that “we are using every available tool to protect lives and property as our fire and emergency response teams work around the clock to combat these challenging fires.”Due to erratic winds and high temperatures, firefighters have been struggling to mount any sort of offense, using most of their resources to try to defend communities in the wildfire’s path. Crews had containment at 3 percent earlier Friday but that then fell back to zero.“This fire has fingers that are growing in different directions depending on which way the wind is blowing,” Butte County Sheriff Kory Honea said at a news conference Friday afternoon.Thousands of people in Butte County, where the fire started, Tehama and Shasta counties have had to evacuate. CalFire said in an update Friday that 4,200 structures are threatened and 134 have been destroyed.On Friday evening, the town of Paradise, which was devastated by the Camp Fire in 2018, issued an evacuation warning due to “fire behavior and predicted winds” and urged residents to prepare to evacuate and await further information.Daniel Swain, a climate scientist at UCLA, described the wildfire’s spread as “astonishing” in a post on social media and said it is “re-writing the record books.”“This is California in the Pyrocene,” Swain wrote, referring to an era characterized by human-caused fire activity, “and a couple of mild fire years (2022/3) don’t alter that long-term trajectory.”"
