DBSCAN_labels,Key,Title,Link,Content
39,CNN_39,California’s Park Fire destroys buildings and forces thousands to flee while in Canada a fast-moving blaze ravages tourist town,https://edition.cnn.com/2024/07/27/us/california-chico-park-fire-canada-jasper-fire/index.html,"
California’s largest wildfire of the year has burned an area larger than the size of the city of Los Angeles, destroyed dozens of buildings and forced thousands of residents to flee their homes as wildfires wreak havoc in the Western United States. Meanwhile, homes and businesses in a popular Canadian resort town were incinerated as a wildfire continued to roar through the area. Here’s the latest:


            • California’s Park Fire now state’s 8th largest: As the Park Fire exploded across parts of Butte and Tehama counties, north of Sacramento, California, it scorched 134 buildings and threatened another 4,200. The fast moving blaze has burned more than 307,000 acres, or about 480 square miles, making it the eighth largest wildfire in recorded state history. More than 2,400 firefighters are working to slow the fire’s progress as it remains 0% contained, according to Cal Fire.
    

            • California governor declares state of emergency: Gov. Gavin Newsom declared a state of emergency for both counties Friday. The state also secured a federal grant to ensure there are enough resources to fight the blaze. The fire is advancing at 4,000 to 5,000 acres per hour, Billy See, incident commander for Cal Fire, said Friday. With winds forecast to die down overnight and higher humidity moving into the area, See believes firefighters will have a better chance to slow the fire down.
    

            • A man is accused of igniting Park Fire: A 42-year-old man, identified as Ronnie Dean Stout II, was arrested on suspicion of pushing a burning car 60 feet into a gully, “spreading flames that caused the Park Fire,” authorities said. The DA says the man was seen “calmly leaving the area by blending in with the other citizens who were in the area and fleeing the rapidly evolving fire.” Stout, who has not retained an attorney, will likely face an arson charge, the DA’s office told CNN.
    

            • Pilot dies while fighting Oregon fire: A firefighting pilot was found dead in a single-engine air tanker on Friday after going missing the night before while working in the vicinity of the 219-square-mile Falls Fire burning in the Malheur National Forest, according to officials. The fire, which was 55% contained as of Saturday morning, is among a number of large wildfires burning across Oregon. The largest active wildfire in the state is the Durkee Fire, which has scorched about 451 square miles and was 27% contained as of Saturday morning.
    

            • Fire wipes out many of a Canadian town’s buildings: A fast-moving wildfire sent thousands of visitors and residents fleeing the town of Jasper in Alberta, where flames devastated an estimated 30% of the town’s structures. Officials say the losses are significant, and Prime Minister Justin Trudeau has deployed federal support to help battle the blaze. Cool temperatures are expected to calm fire behavior, which will help the 154 firefighters in Jasper fight the blaze, Jasper National Park said on Facebook Friday night. High winds, however, could increase fire activity.
    

            • 96 large wildfires burning nationwide: Triple-digit heat and dry conditions across the West this week have made conditions poor for firefighters actively fighting to contain the dozens of wildfires burning nationwide, including 37 in Oregon and 14 in California. “Elevated to critical fire weather conditions will persist through the weekend across the Western U.S. Isolated dry thunderstorms could lead to new fire starts over portions of the northern Rockies,” the National Weather Service said. Smoke from wildfires will also result in continued unhealthy air quality.
    

            The Park Fire, which began Wednesday in the Chico area, has forced about 4,000 people to evacuate in Butte County, where the state’s deadliest wildfire, the Camp Fire, killed more than 85 people and destroyed thousands of homes in 2018.
    

            A heavy plume of smoke once again looms over the county as crews battle thick flames that are torching everything in their path. The Park Fire has left graveyards of burned cars and charred, hallowed out structures, video from the Chico area shows.
    

            For Butte County residents, the advancing flames bring with them painful memories of the losses they endured from the Camp Fire six years ago.
    

            One evacuee, Tim Ferguson, told CNN affiliate KOVR he had lost his father in the Camp Fire, and it’s painful thinking about having to experience more loss this time around.
    

            “We’ve got our home, and we’ve been working on it a lot lately, fixing it up, and it’s just we’re at the verge of maybe losing all that,” Ferguson said.
    

            Lauri Schwein, who lost her home in the Camp Fire, told CNN affiliate KCRA she’s on high alert. “I’m packing up, my dog, my cat,” she said. “All I can do is wait and watch.”
    

            In the town of Paradise, the smoke is enough to bring back the horrors the Camp Fire unleashed when it incinerated much of the town.
    

            “It was very impactful, every once in a while we smell smoke or see smoke like that, it does trigger us. It triggers the people here in Paradise. When you go through trauma, that’s what happens,” Ron Lassonde, the mayor of Paradise, told KCRA.
    

            Paradise is under an evacuation warning, according to the town web site. “An EVACUATION WARNING means prepare to evacuate and await additional instructions, under a warning those who need additional time to evacuate should begin evacuating now,” officials cautioned.
    

            The Park Fire is burning just three weeks after the Thomspon Fire in Butte County burned more than 3,700 acres, forced people from their homes, and destroyed more than two dozen structures, including houses.
    

            Local officials cautioned it would take some time before people would be allowed back in their homes.
    

            “We are no strangers to evacuations in Butte County,” said Butte County Sheriff Kory Honea at a news conference Friday. “We are constantly looking for the earliest opportunity to get people back in.”
    

            The North Valley Animal Disaster Group has rescued 88 animals from the blaze as its members dealt with losses of their own. In 2018, the group managed to shelter over 4,000 animals during the Camp Fire.
    

            “When you’ve been through a big fire and you’ve lost everything, sometimes the only thing you have left to give is to go help the animals,” Vice President Norm Rosene told CNN.
    

            Triple-digit temperatures and high wind gusts have fueled the explosive growth of the Park Fire amid an active fire season in California. An estimated 626,600 acres have burned across the state so far in 2024, compared to 25,254 acres burned by this time last year, according to Cal Fire.
    

            “It’s been nothing but challenging,” Cal Fire Captain Dan Collins told CNN. “If we see fires behave like this in July, they may behave even more radically come the fall when the fields are even drier.”
    

            In Jasper, a popular tourist town in Alberta, 25,000 residents and visitors were forced to evacuate from a fast-moving blaze that has destroyed 30% of the town’s structures, officials said.
    

            Two wildfires converged in the Jasper National Park area, becoming what authorities are referring to as the Jasper Wildfire Complex. It remains difficult to measure exactly how big the complex – which also includes a third nearby fire – is due to extreme fire behavior and thick smoke cover. Together, the fires have swallowed an estimated 89,000 acres, the Jasper National Park said.
    

            An evacuation order remains in effect for Jasper and Jasper National Park, with the vast majority of evacuees being visitors, officials said. Along with about 4,100 residents – and thousands of seasonal workers – who live in the town, 2.48 million people visited Jasper National Park last year.
    

            Out of a total of 1,113 structures in the town, 358 have been destroyed, according to a Facebook post from Jasper National Park.
    

            The owner of Maligne Lodge in Jasper told CNN news partner CTV News that she was shocked when she saw a photo of the 98-room hotel up in flames. It had been in the family since 1961 after her father purchased the property, and she had been working there since she was a child.
    

            “As soon as we’re given the go-ahead, we’ll be in there rebuilding our hotel,” Karyn Decore said.
    

            Jasper Mayor Richard Ireland lost the home that his family had moved into around his second birthday, according to CTV News.
    

            On a tour of the wreckage in Jasper, Ireland said that the loss of his home of 67 years “is shattering.”
    

            “Now it’s memories of family and fire,” Ireland told CNN news partner CBC. “So many others are going to go through this same thing.”
    

            But he said “when I stood back and looked, and saw what remains, I know that the community is still there.”
    

  CNN’s Raja Razek, Paradise Afshar, Taylor Romine, Kara Mihm and Jillian Sykes contributed to this report.
"
40,CNN_16,Israel issues fresh evacuation order in Gaza’s Khan Younis after renewed offensive displaces tens of thousands,https://edition.cnn.com/2024/07/27/middleeast/israel-evacuation-order-gaza-khan-younis-intl-hnk/index.html,"
            Israel’s military issued new evacuation orders for residents in Gaza’s southern city of Khan Younis, warning it would “forcefully operate” in southern neighborhoods as it presses on with an operation that has already displaced tens of thousands.
    

            Khan Younis has faced intensifying bombardment recently, and a fresh Israeli ground assault launched earlier this week has killed dozens of Palestinians. The Israel Defense Forces (IDF) warned on Monday it would reduce its so-called humanitarian zone in the eastern part of the city, due to intelligence that militant group Hamas had embedded in the area.
    

            Fighting has been ongoing on Gaza for months, and the renewed offensive shows Israel’s challenges in achieving its goal of eliminating Hamas. Israel said that about 100 militants had been killed during recent fighting.
    

            The United Nations estimated that about 150,000 people fled Khan Younis on Monday alone, intensifying pressure on meager supplies of food and water, and places to seek shelter.
    

Related article
‘We cannot remain silent about what we saw.’ US doctors who volunteered in Gaza demand ceasefire in letter to White House


            Signaling another campaign was imminent, the IDF wrote on Telegram it was “about to forcefully operate against the terrorist organizations and therefore calls on the remaining population left in the southern neighborhoods of Khan Yunis to temporarily evacuate to the adjusted Humanitarian Area in Al-Mawasi.”
    

            An eyewitness in Khan Younis told CNN that she was “woken up by the screams” of people as they fled the area following the evacuation order.
    

            The eyewitness told CNN that she could hear clearly hear the sound of clashes and explosions in Khan Yunis and saw flares in the sky overnight. According to her, people are now fleeing the area.
    

            The designated humanitarian area in Al-Mawasi has come under repeated Israeli attacks, including a strike on July 14 which reportedly killed 90 people and injured 300 more.
    

            The statement said the move was in retaliation to “significant terrorist activity and rocket fire” emanating from southern Khan Younis. It added that the location previously defined as a humanitarian area “will be adjusted.”
    

            Israel launched its military offensive in Gaza on October 7 after Hamas attacked southern Israel. At least 1,200 people were killed and more than 250 others abducted, according to Israeli authorities.
    

            Israeli military action in Gaza has since killed 39,090 Palestinians and injured another 90,147, according to the Ministry of Health there. As of early July, nearly 2 million people had been displaced in Gaza – almost the entire population, according to figures from the UN.
    

            The military said on Saturday that “the calls for the temporary evacuation are being communicated to residents through SMS messages, recorded voice messages, phone calls, media broadcasts in Arabic and flyers,” adding that the early warning to civilians was “being made in order to mitigate harm to the civilian population.”
    

            Aid agencies working in Gaza have warned previously that new rounds of evacuation orders are making the delivery of emergency rations even more difficult.
    

            “People in Gaza are exhausted, living in inhumane conditions, with no safety at all,” the UN Relief and Works Agency posted on X on Monday.
    

            On Thursday, the IDF said it had recovered the bodies of five Israeli hostages the previous day from a tunnel in an area of Khan Younis which it had previously designated as a “humanitarian area.”
    

            Despite the fighting, US and Israeli officials expressed optimism this week over the possibility of a ceasefire and hostage deal being reached.
    

            US Secretary of State Antony Blinken said Friday that the different parties are “inside the 10-yard line and driving toward the goal line.”
    

            Israel’s Prime Minister, Benjamin Netanyahu, said he would likely dispatch a negotiation team to talks in Rome next week.
    

            Netanyahu was in Washington this week and met with the presumptive Democratic presidential nominee, Vice President Kamala Harris, who urged him to seal an agreement.
    

            “As I just told Prime Minister Netanyahu, it is time to get this deal done,” said Harris. “So to everyone who has been calling for a ceasefire, and to everyone who yearns for peace, I see you and I hear you.”
    "
46,CNN_30,"At least 30 killed in an Israeli airstrike on a school in Gaza, Palestinian officials say",https://edition.cnn.com/2024/07/27/middleeast/israel-gaza-deir-al-balah-school-intl/index.html,"
            At least 30 people have been killed and over 100 injured in an Israeli airstrike on a school in Deir-al Balah, central Gaza, according to the Palestinian Ministry of Health in Gaza.
    

            The Israeli military it had launched the strike in order to destroy a Hamas command and control center inside the compound.
    

            Most of the victims from the school arriving to Al-Aqsa Martyrs Hospital in the aftermath of the attack were women and children, according to Dr. Khalil Al-Daqran, a spokesperson for the hospital. More than 4,000 displaced people were housed in the school, the Palestinian Civil Defense said.
    

            The strike came soon after Israeli’s military issued fresh evacuation orders further south, in the city of Khan Younis, where Israel launched a fresh offensive earlier in the week which has killed dozens of Palestinians.
    

            Residents in southern neighborhoods were told to leave after being warned that the Israel Defense Forces (IDF) would “forcefully operate” in the area.
    

            Fighting has been ongoing on Gaza for months, and the renewed offensive shows Israel’s challenges in achieving its goal of eliminating Hamas. Israel said that about 100 militants had been killed during recent fighting.
    

            The United Nations estimated that about 150,000 people fled Khan Younis on Monday alone, intensifying pressure on meager supplies of food and water, and places to seek shelter.
    

Related article
‘We cannot remain silent about what we saw.’ US doctors who volunteered in Gaza demand ceasefire in letter to White House


            Signaling another campaign was imminent, the IDF wrote on Telegram it was “about to forcefully operate against the terrorist organizations and therefore calls on the remaining population left in the southern neighborhoods of Khan Yunis to temporarily evacuate to the adjusted Humanitarian Area in Al-Mawasi.”
    

            The statement said the move was in retaliation to “significant terrorist activity and rocket fire” emanating from southern Khan Younis. It added that the location previously defined as a humanitarian area “will be adjusted.”
    

            Al-Mawasi has come under repeated Israeli attacks, including a strike on July 14 which reportedly killed 90 people and injured 300 more.
    

            An eyewitness in Khan Younis told CNN that she was “woken up by the screams” of people as they fled the area following the evacuation order, saying she heard explosions and saw flares in the sky.
    

            Scenes filmed by CNN in Khan Younis show people fleeing by car, motorbike, and donkey cart with all of their belongings. “I am looking for a place to stay. I don’t know where to go,” said one man.
    

            Israel launched its military offensive in Gaza on October 7 after Hamas attacked southern Israel. At least 1,200 people were killed and more than 250 others abducted, according to Israeli authorities.
    

            Israeli military action in Gaza has since killed 39,258 Palestinians and injured another 90,589, according to the Ministry of Health there. As of early July, nearly 2 million people had been displaced in Gaza – almost the entire population, according to figures from the UN.
    

            Aid agencies working in Gaza have warned previously that new rounds of evacuation orders are making the delivery of emergency rations even more difficult.
    

            “People in Gaza are exhausted, living in inhumane conditions, with no safety at all,” the UN Relief and Works Agency posted on X on Monday.
    

            On Thursday, the IDF said it had recovered the bodies of five Israeli hostages the previous day from a tunnel in an area of Khan Younis which it had previously designated as a “humanitarian area.”
    

            Despite the fighting, US and Israeli officials expressed optimism this week over the possibility of a ceasefire and hostage deal being reached.
    

            US Secretary of State Antony Blinken said Friday that the different parties are “inside the 10-yard line and driving toward the goal line.”
    

            Negotiations are set to resume in Rome on Sunday, two sources familiar with the meeting told CNN.
    

            The US team will be led by CIA Director Bill Burns, who will be joined by his counterparts from Qatar, Egypt, and Israel.
    

            Israel’s Prime Minister Benjamin Netanyahu was in Washington this week and met with the presumptive Democratic presidential nominee, Vice President Kamala Harris, who urged him to seal an agreement.
    

            “As I just told Prime Minister Netanyahu, it is time to get this deal done,” said Harris. “So to everyone who has been calling for a ceasefire, and to everyone who yearns for peace, I see you and I hear you.”
    

This story has been updated with additional information. 
"
