DBSCAN_labels,Key,Title,Link,Content
0,NBC_1,FBI confirms that a bullet struck Trump's ear during assassination attempt,https://www.nbcnews.com/politics/donald-trump/fbi-confirms-bullet-struck-trumps-ear-assassination-attempt-rcna163896,"The FBI said Friday that a bullet or fragments of it struck Donald Trump's ear during an assassination attempt on the former president this month at a campaign rally.
“What struck former President Trump in the ear was a bullet, whether whole or fragmented into smaller pieces, fired from the deceased subject’s rifle,"" the FBI said in a statement.
The statement comes two days after FBI Director Christopher Wray, whom Trump nominated to his post in 2017, told House lawmakers that ""there’s some question about whether or not it’s a bullet or shrapnel that, you know, hit his ear.""
Wray had testified about the FBI's ongoing probe into the assassination attempt. A gunman identified as Thomas Crooks, 20, was shot and killed after opening fire from an elevated post not far from Trump's July 13 rally in Butler, Pennsylvania, that left one spectator dead and two others critically injured.
The director's remarks before a House committee sparked widespread backlash among Republican lawmakers, as well as Trump.
Trump referred to the new FBI statement in a social media post Friday night.
""I assume that’s the best apology that we’ll get from Director Wray, but it is fully accepted!,"" he wrote on Truth Social.
House Speaker Mike Johnson had also criticized Wray's testimony.
“We’ve all seen the video, we’ve seen the analysis, we’ve heard it from multiple sources in different angles that a bullet went through his ear. I’m not sure it matters that much,” Johnson said on Thursday.
Wray’s testimony came the same day the House approved a resolution to create a bipartisan task force to examine the assassination attempt.
Before the FBI put out its statement Friday night, Sen. Lindsey Graham, R-S.C., had written a letter to Wray urging him to revise his testimony, saying, ""the attempted assassin’s bullet ripped the upper part"" of Trump's ear, and that it ""should not be a point of contention.""
Graham said Friday night, after the FBI's statement, that Wray should never have suggested otherwise.
""Glad the FBI confirmed what everyone else knew. It was a bullet that struck President Trump. The statement by the FBI Director should’ve never been made,"" Graham wrote on X.Ken Dilanian is the justice and intelligence correspondent for NBC News, based in Washington.
Zoë Richards is a politics reporter for NBC News."
0,CNN_1,"Trump was struck by bullet in assassination attempt, FBI says",https://edition.cnn.com/2024/07/26/politics/fbi-trump-interview-assassination-attempt/index.html,"
            The FBI said Friday that Donald Trump was hit by a bullet, or a fragment from it, fired by the would-be assassin at his Pennsylvania rally earlier this month.
    

            “What struck former President Trump in the ear was a bullet, whether whole or fragmented into smaller pieces, fired from the deceased subject’s rifle,” the bureau said in a statement.
    

            The department’s confirmation Friday that the former president was struck in the ear by a bullet marks its latest attempt to quell a political uproar. The new statement is the most direct yet from federal law enforcement about Trump’s injury, though it changes little in practical terms.
    

            Some law enforcement officials – including FBI Director Christopher Wray – have previously said publicly that it was unclear whether Trump was hit by a bullet or by shrapnel, which is a fragmented piece of ammunition. Other officials questioned whether Trump had been struck by a bullet at all, or whether he was hit by a piece of glass or even injured while falling down.
    

            “As I said, I think with respect to former President Trump, there’s some question about whether or not it’s bullet or shrapnel that hit his ear,” Wray testified before Congress earlier this week.
    

            Questions about Trump’s wound have stoked political backlash, as the former president has said he “took a bullet for democracy” and attacked Wray on his social media platform over his testimony.
    

            For his part, Trump has repeatedly asserted that he was hit by an in-tact bullet, writing on his Truth Social platform that “it was, unfortunately, a bullet that hit my ear, and hit it hard.”
    

            “There was no glass, there was no shrapnel. The hospital called it a ‘bullet wound to the ear,’ and that is what it was. No wonder the once storied FBI has lost the confidence of America!” Trump posted.
    

            The campaign also has pushed back on any implication otherwise, with Trump adviser Steven Cheung telling CNN that “anyone who believes this conspiracy bullsh*t is either mentally deficient or willfully peddling falsehoods for political reasons.”
    

            The agency is seeking to interview Trump in its investigation of the assassination attempt to obtain a victim statement — a standard part of the investigation because he is a crime victim, according to a US official.
    

            Investigators, the FBI said Thursday, continue to examine bullet fragments and other evidence in the attack, but the agency made clear it has always considered the shooting an attempted assassination of the former president.
    

            “Since the day of the attack, the FBI has been consistent and clear that the shooting was an attempted assassination of former President Trump which resulted in his injury, as well as the death of a heroic father and the injuries of several other victims,” the agency said in its initial statement released in response to questions about Wray’s testimony on Capitol Hill Wednesday.
    

            The agency said it was “devoting enormous resources” to its ongoing investigation of the “heinous attack.”
    

            During Wednesday’s wide-ranging House Judiciary hearing, Wray shared new details with lawmakers about Trump’s would-be assassin, including that he searched for details of the John F. Kennedy shooting from his laptop and flew a drone in the area near the rally just two hours before the former president took the stage.
    

            Despite later criticism from Republicans about the FBI’s pending conclusions about the nature of the projectile, Wray was commended by representatives on both sides of the aisle for offering new insight into details about the investigation into the gunman. Those bipartisan expressions of appreciation stood in stark contrast to earlier testimony by then-Secret Service director Kimberly Cheatle, who resigned Tuesday after Democrats and Republicans accused her of stonewalling them and demanded her ouster.
    

            When asked Wednesday about how close the “assassin’s bullet” came to killing Trump, Wray said, “My understanding is that either it or some shrapnel is what, you know, grazed his ear.” He then agreed that it came very close to killing the former president.
    

This headline and story have been updated with additional information.
"
0,WaPo_2,"A bullet — or bullet fragment — hit Trump during assassination attempt, FBI says",https://www.washingtonpost.com/nation/2024/07/26/trump-bullet-shot-assassination-attempt/,"Former president Donald Trump was shot in the ear by a bullet or a bullet fragment during the assassination attempt at one of his campaign rallies, the FBI said Friday, responding to an outcry sparked when FBI Director Christopher A. Wray testified Wednesday that the former president and Republican nominee was wounded by either a bullet or shrapnel.For nearly two weeks, there had been speculation about whether Trump had been grazed by a bullet (or fragments of one) or nicked by other debris during his July 13 campaign rally in which 20-year-old gunman Thomas Matthew Crooks opened fire at Trump and into the crowd in Butler, Pa. Wray maintained in congressional testimony Wednesday that investigators hadn’t reached a definitive conclusion while Trump and his Republican allies insisted he had been shot.The FBI on Friday said the Republican presidential nominee was hit with a bullet.“What struck former President Trump in the ear was a bullet, whether whole or fragmented into smaller pieces, fired from the deceased subject’s rifle,” the agency said in a statement.A Washington Post analysis of photos and videos of the shooting found that former president Trump’s injury appears to be consistent with the attributes of a graze wound from a bullet and not that of bullet fragments, according to two trauma surgeons, Babak Sarani, director of trauma and acute care surgery at George Washington University Hospital, and Joseph Sakran, director of emergency general surgery at Johns Hopkins. The physicians reviewed the Post’s analysis.“Usually shrapnel flies in random patterns. Because it’s shrapnel, right? It doesn’t go in a straight line. This really looks like a linear laceration is how I would describe,” Sarani told The Post. “So it’s something, it’s going in a straight line which makes you think it’s more the projectile itself, not shrapnel.”High-velocity rounds, such as those likely fired by Crooks, impart energy, or a blast effect when striking a body. A graze wound like that of the former president would not, Sarani said.“The bullet literally just grazes you and so very little energy is imparted into you. The rest of it is just dissipated into the air.” he added. “That’s how you, if you are, quote unquote, lucky. The bullet just grazed you.”Just hours after the assassination attempt, Trump started insisting he had been hit with a bullet.“I was shot with a bullet that pierced the upper part of my right ear,” he wrote in a Truth Social post that published at 8:42 p.m. on July 13, less than three hours after the shooting. “I knew immediately that something was wrong in that I heard a whizzing sound, shots, and immediately felt the bullet ripping through the skin. Much bleeding took place, so I realized then what was happening.”Wray testified to the House Judiciary Committee that the exact nature of Trump’s injury remained uncertain. “I think with respect to former president Trump, there’s some question about whether or not it’s a bullet or shrapnel that, you know, hit his ear,” he told lawmakers Wednesday.Rep. Ronny Jackson (R-Tex.), the former White House doctor who has been monitoring Trump’s health since the assassination attempt, criticized Wray’s comments.“There is absolutely no evidence that it was anything other than a bullet,” Jackson wrote in an update on Trump’s health. “Congress should correct the record as confirmed by both the hospital and myself. Director Wray is wrong and inappropriate to suggest anything else.”On Friday, Sen. Lindsey O. Graham (R-S.C.) sent a letter to Wray, urging him to “correct your testimony before Congress on Wednesday when you indicated it is uncertain whether President Donald J. Trump was hit by a bullet, glass, or shrapnel.”“It is clear to everyone that President Trump survived an assassination attempt by millimeters, as the attempted assassin’s bullet ripped the upper part of his ear,” Graham wrote in a letter that Trump published Friday in a Truth Social post.It was one of several posts Trump wrote criticizing Wray’s testimony over the past two days.He posted another late Friday after the release of the FBI statement confirming he had been shot.“I assume that’s the best apology that we’ll get from Director Wray,” he said of the FBI’s conclusion, “but it is fully accepted!”"
2,NBC_3,Packers sign Jordan Love to richest QB contract in NFL history,https://www.nbcnews.com/news/sports/packers-sign-qb-jordan-love-richest-qb-contract-nfl-history-rcna163353,"The Packers have signed Jordan Love to the richest contract for a quarterback in NFL history, per multiple reports. The four-year deal is for $220 million. 
Love, 25, was the No. 26 overall pick of the 2020 NFL Draft. Last season, in his first full year as a starter, he started all 17 games for Green Bay, throwing for 4,159 yards with 32 touchdowns, 11 interceptions and a 96.1 passer rating. Love led the Packers to the playoffs for the first time since 2021 and threw five touchdowns and two picks across two games.
The new contract also includes a record $75 million signing bonus, plus $155 million in new full guarantees, ESPN's Adam Schefter reported.
The new contract pays Love more than his contemporaries, including Kansas City’s Patrick Mahomes, Cincinnati’s Joe Burrow and Baltimore’s Lamar Jackson. His deal seemingly resets the quarterback market after extensions signed by Jared Goff and Trevor Lawrence earlier this summer. Love’s new agreement will pay him an average of $55 million annually, equaling the amount shared by Burrow and Lawrence, ESPN reported. 
Before Love’s new deal, he was entering the final year of a contract set to pay him $11 million in 2024. 
The Packers drafted Love in 2020 despite still having former NFL MVP Aaron Rodgers under contract at the time. Rodgers would continue to be the team’s starter for three more seasons through 2022. During that period, however, Green Bay only won one playoff game — the same number Love won last season. 
For his career, Love has appeared in 27 games, throwing for 35 touchdowns and 14 interceptions. In 18 total starts he has a 9-9 record. He is 1-1 in the postseason, upsetting the Dallas Cowboys before losing to the San Francisco 49ers last January. 
After finishing last season 9-8 before losing in the Divisional Round of the playoffs, the Packers will open their 2024 season against the Philadelphia Eagles on Sept. 6 in a game that will be streamed on Peacock. Rohan Nadkarni is a sports reporter for NBC News. "
2,WaPo_14,"After 18 starts, Packers make Jordan Love one of NFL’s richest QBs",https://www.washingtonpost.com/sports/2024/07/26/jordan-love-contract-packers/,"On a day of more megadeals for prominent NFL quarterbacks, Jordan Love landed a hefty contract extension that puts him among the league’s highest-paid players after only 18 career regular season starts.Love, after taking the Green Bay Packers to the divisional round of the NFC playoffs in his first full season as the starter, agreed to a four-year, $220 million extension, two people familiar with the negotiations confirmed Friday night. The production company for Love’s agents also confirmed the agreement on social media.The $55 million average annual value of Love’s extension matches the $55 million-per-year extensions previously signed by Joe Burrow with the Cincinnati Bengals and Trevor Lawrence with the Jacksonville Jaguars. They are, by that measure, the highest-paid players in NFL history.Love’s deal includes a record $75 million signing bonus, according to the people with knowledge of the contract terms, and $155 million in fully guaranteed money. He reported to the Packers’ training camp but would not practice until the extension was completed.Love threw for 4,159 yards and 32 touchdowns during the 2023 regular season. The Packers went 9-8 and reached the playoffs as a wild card, then upset the Dallas Cowboys in an opening-round NFC game before losing to the San Francisco 49ers in a conference semifinal. Love spent his first three seasons backing up Aaron Rodgers after being chosen, controversially, by the Packers in the first round of the 2020 draft.Earlier Friday, quarterback Tua Tagovailoa agreed to a four-year, $212.4 million extension with the Miami Dolphins. The $53.1 million average annual value of Tagovailoa’s extension puts him behind only Love, Burrow and Lawrence."
8,NBC_9,Trump hails crypto at largest bitcoin conference,https://www.nbcnews.com/politics/donald-trump/trump-hails-crypto-largest-bitcoin-conference-rcna163925,"NASHVILLE, Tenn. — Republican presidential nominee Donald Trump promised to make America the world leader in bitcoin and other digital currencies if elected, likening the crypto-verse to “the steel industry of 100 years ago.”
Speaking at the annual Bitcoin Conference in Nashville, Tennessee, to a standing-room-only crowd, Trump promised to ensure America becomes “the crypto capital of the planet and bitcoin superpower of the world.”
Trump painted himself as a crypto advocate in contrast to the Biden administration and other Democrats, who he said had proven unfriendly to their cause.
Trump said — to rapturous applause from the Nashville crowd — that if elected, he would fire current Securities and Exchange Commission Chair Gary Gensler, whom the crypto world has come to view as its chief opponent in government due to his agency’s rulings on digital tokens and lawsuits against bitcoin exchanges.
“I will appoint an SEC chair who will build the future, not block the future,” Trump said.
His embrace of crypto comes amid high-profile endorsements from bitcoin advocates including Tesla CEO Elon Musk and Cameron and Tyler Winklevoss, the twin brothers best known for suing Mark Zuckerberg over the creation of Facebook and who founded the Gemini cryptocurrency exchange.
Trump’s remarks stand to further cement his growing alliance with other right-leaning figures in the tech world, though the novelty of his appearance at the conference was not lost on him. As he praised the audience as “geniuses,” he acknowledged he was still learning about crypto.
“Most people have no idea what the hell it is,” he quipped. “So what happens when everyone figures it out? That’ll be something.”
Trump offered up a proposal to create a national bitcoin “stockpile” that he said would serve as a “permanent national asset,” though stopped short of offering many details.
The idea of creating a strategic crypto reserve has caught on quickly among bitcoin supporters. On Friday, independent presidential candidate Robert F. Kennedy Jr. also proposed creating a bitcoin reserve, saying he would direct the Treasury to purchase 4 million bitcoins, which in today’s prices would equate to approximately $272 billion.
Immediately following Trump’s remarks, Sen. Cynthia Lummis, R-Wyo., said she would introduce a bill to create the reserve.
However, the price of bitcoin fell slightly in the wake of Trump’s remarks Saturday, perhaps reflecting crypto traders’ unmet expectations for a more definitive commitment on the reserve idea from the presidential candidate.
While the Bitcoin Conference is officially apolitical, Trump’s speech punctuated an event whose politico panelists leaned Republican, including four sitting GOP senators and three GOP Senate candidates.
The sole elected Democrat, California Rep. Ro Khanna, spoke early Saturday and criticized the tendency within his own party to further entrench traditional centers of finance.
“I thought the Democrats were opposed to monopoly power. … We don’t want the banks and the Fed to have a monopoly on fast payments,” Khanna said at a panel Saturday.
Shortly after his morning remarks, Bitcoin Magazine reported that a group of Democratic representatives and candidates had sent a letter to the Democratic National Committee urging party leaders to be more supportive of crypto.
In addition to Khanna, the letter’s signatories included representatives in purple districts in critical swing states like North Carolina and Arizona.
The current administration’s “hostility,” the signees said, does not reflect “our Party’s progressive, forward-looking, and inclusive values.”
“A refreshed leader of the ticket represents an opportunity to change that perception,” they wrote.
In a follow-up interview with NBC News at the conference, Khanna said that positively engaging with the crypto community would be in keeping with Democrats’ desire to be “the party of the future.”
“They’re passionate, they’re active on social media, and they’re mobilized,” Khanna said. “And it’s a community that’s going to vote.”
Conference organizers say Democratic presidential candidate Kamala Harris declined an invitation to appear at the conference. The organizers declined to comment further on the matter, though conference head David Bailey criticized Harris’ absence on X. Harris’ campaign has not commented.
In an interview with NBC News on Friday, Bailey said that despite Harris not appearing at the conference, the window had not closed on Democrats’ ability to win support from the crypto community.
“There’s a whole progressive case for bitcoin,” he said. While that rationale may not have received as much notice, Bailey said, “my intuition is, over the next four years, it will.”
On Saturday, the Financial Times reported Harris had approached top crypto companies seeking a “reset” of relations, citing unnamed sources.
Bailey said it would ultimately become a political necessity for all political parties to engage with bitcoin supporters as a political bloc.
“It’s not too late — in fact, everyone will have to come to terms with it,” he said. “They won’t be viable otherwise.”
Outside the conference early Saturday, pro-Trump bitcoin supporters made their presence known.
Chad Kozman, an Ohio resident, sported a “Free Ross/Vote Trump” shirt, referring to the community’s desire to see Silk Road founder Ross Ulbricht’s life sentence on drug and money-laundering charges commuted, something Trump has promised he would do.
Kozman told NBC News that while Trump’s overtures to the crypto community were opportunistic, it was also a sign that the community had matured beyond its individualistic roots into a voting group that had to be reckoned with.
“For the bitcoin community, it’s been a really hard road to get people to see the benefits of collectivization and pulling together,” he said.Rob Wile is a Pulitzer Prize-winning journalist covering breaking business stories for NBCNews.com."
21,FOX_13,DOJ settles with former FBI officials over release of anti-Trump texts,https://www.foxnews.com/politics/doj-settles-former-fbi-officials-over-release-anti-trump-texts,"Fox News Flash top headlines are here. Check out what's clicking on Foxnews.com.
The Department of Justice has settled with two former FBI officials over violation of privacy rights.
Former counterintelligence agent Peter Strzok and FBI lawyer Lisa Page filed suit against the Justice Department over the release of their text message conversations expressing contempt for former President Donald Trump.
According to court documents reviewed by the Associated Press, Strzok settled his case for $1.2 million, while Page received $800,000.
DOJ REACHES SETTLEMENT WITH EX-FBI 'LOVEBIRDS' CAUGHT IN ANTI-TRUMP TEXT SCANDAL
Ex-FBI official Peter Strzok was fired in 2018 for sending out anti-Trump texts. (Reuters)
In 2019, Strzok argued in a court filing in Washington, D.C., federal district court that his politically charged anti-Trump messages were protected by the First Amendment even though he sent them on bureau-issued phones while playing leading roles in the probes into both Hillary Clinton and Donald Trump.
Strzok, once the FBI's head of counterintelligence, said he was entitled to ""develop a full factual record through discovery,"" and that it would be premature to dismiss the case at this early stage. He went on to argue that the DOJ's position would ""leave thousands of career federal government employees without protections from discipline over the content of their political speech.""
""This outcome is a critical step forward in addressing the government’s unfair and highly politicized treatment of Pete,"" said lawyer Aitan Goelam, who is representing Strzok. 
DISGRACED EX-FBI AGENT PETER STRZOK REACTS TO DURHAM REPORT ON TRUMP-RUSSIA COLLUSION WITH VICTORY LAP
Republican presidential candidate and former president, Donald Trump, speaks during the final day of the Republican National Convention in Milwaukee.  (AP Photo/Paul Sancya)
Goelam continued, ""As important as it is for him, it also vindicates the privacy interests of all government employees. We will continue to litigate Pete’s constitutional claims to ensure that, in the future, public servants are protected from adverse employment actions motivated by partisan politics.""
Page also filed suit against the FBI and Department of Justice, alleging the government's publication of her salacious text messages with Strzok constituted a breach of the Federal Privacy Act.
CLICK HERE TO GET THE FOX NEWS APP
Lisa Page, former legal counsel to former FBI Director Andrew McCabe, arrives at Capitol Hill to speak before the House Judiciary and Oversight Committee on Capitol Hill in Washington, D.C. (ANDREW CABALLERO-REYNOLDS/AFP via Getty Images)
""While I have been vindicated by this result, my fervent hope remains that our institutions of justice will never again play politics with the lives of their employees,"" Page said in a statement.
Page's complaint also sought reimbursement for ""the cost of childcare during and transportation to multiple investigative reviews and appearances before Congress,"" the ""cost of paying a data-privacy service to protect her personal information"" and attorney's fees.
Fox News Digital's Jamie Joseph contributed to this report.
Timothy Nerozzi is a writer for Fox News Digital. You can follow him on Twitter @timothynerozzi and can email him at timothy.nerozzi@fox.com"
